{
  "schema": "silver",
  "name": "usp_load_dimmultiwriter_archive",
  "references": {
    "tables": {
      "in_scope": [
        {
          "schema": "bronze",
          "name": "Product",
          "is_selected": true,
          "is_updated": false,
          "columns": [
            {
              "name": "ProductID",
              "is_selected": true,
              "is_updated": false
            },
            {
              "name": "DiscontinuedDate",
              "is_selected": true,
              "is_updated": false
            }
          ]
        },
        {
          "schema": "silver",
          "name": "DimMultiWriter",
          "is_selected": false,
          "is_updated": true,
          "columns": [
            {
              "name": "AlternateKey",
              "is_selected": true,
              "is_updated": false
            },
            {
              "name": "IsActive",
              "is_selected": false,
              "is_updated": true
            },
            {
              "name": "ModifiedDate",
              "is_selected": false,
              "is_updated": true
            }
          ]
        }
      ],
      "out_of_scope": []
    },
    "views": {
      "in_scope": [],
      "out_of_scope": []
    },
    "functions": {
      "in_scope": [],
      "out_of_scope": []
    },
    "procedures": {
      "in_scope": [],
      "out_of_scope": []
    }
  },
  "statements": [
    {
      "type": "Set",
      "action": "skip",
      "source": "ast",
      "sql": "SET NOCOUNT ON"
    },
    {
      "type": "Update",
      "action": "migrate",
      "source": "ast",
      "sql": "UPDATE silver.DimMultiWriter SET IsActive = 0, ModifiedDate = GETDATE() WHERE AlternateKey IN (SELECT CAST(ProductID AS NVARCHAR(20)) FROM bronze.Product WHERE DiscontinuedDate IS NOT NULL)"
    }
  ]
}
