{
  "schema": "dbo",
  "name": "usp_load_dimdate",
  "statements": [
    {"index": 0, "action": "migrate", "source": "ast", "sql": "INSERT INTO silver.DimDate SELECT ..."}
  ],
  "references": {
    "tables": {"in_scope": [], "out_of_scope": []},
    "views": {"in_scope": [], "out_of_scope": []},
    "functions": {"in_scope": [], "out_of_scope": []},
    "procedures": {"in_scope": [], "out_of_scope": []}
  }
}
