{
  "schema": "silver",
  "name": "usp_load_factinternetsales",
  "references": {
    "tables": {
      "in_scope": [
        {
          "schema": "silver",
          "name": "factinternetsales",
          "is_selected": false,
          "is_updated": true,
          "detection": "ast_scan"
        },
        {
          "schema": "silver",
          "name": "usp_stage_FactInternetSales",
          "is_selected": false,
          "is_updated": false
        }
      ],
      "out_of_scope": []
    },
    "views": {
      "in_scope": [],
      "out_of_scope": []
    },
    "functions": {
      "in_scope": [],
      "out_of_scope": []
    },
    "procedures": {
      "in_scope": [],
      "out_of_scope": []
    }
  },
  "statements": []
}
